{
  "$schema": "https://raw.githubusercontent.com/obedebessa/eacp-operational-provenance/v1.3.0/experiments/github_actions/schema/github-actions-capture-v1.3.schema.json",
  "artifacts": [],
  "capture": {
    "acquisition": "github-rest-api",
    "authenticated": true,
    "captured_at": "2026-09-02T20:41:04Z",
    "excluded": [
      "workflow logs",
      "artifact contents",
      "event payload",
      "commit messages and author emails",
      "runner identifiers and runner group names",
      "URL credentials, query parameters, and fragments"
    ],
    "raw_api_payload_retained": false,
    "sanitization_profile": "public-metadata-minimal-v1",
    "transport": "gh"
  },
  "jobs": [
    {
      "completed_at": "2026-08-06T05:53:05Z",
      "conclusion": "success",
      "created_at": "2026-08-06T05:52:52Z",
      "html_url": "https://github.com/obedebessa/eacp-operational-provenance/actions/runs/31075453078/job/92532374560",
      "id": 92532374560,
      "labels": [
        "ubuntu-latest"
      ],
      "name": "reproduce-small",
      "run_attempt": 1,
      "run_id": 31075453078,
      "started_at": "2026-08-06T05:52:54Z",
      "status": "completed",
      "steps": [
        {
          "completed_at": "2026-08-06T05:52:56Z",
          "conclusion": "success",
          "name": "Set up job",
          "number": 1,
          "started_at": "2026-08-06T05:52:55Z",
          "status": "completed"
        },
        {
          "completed_at": "2026-08-06T05:52:58Z",
          "conclusion": "success",
          "name": "Check out repository",
          "number": 2,
          "started_at": "2026-08-06T05:52:56Z",
          "status": "completed"
        },
        {
          "completed_at": "2026-08-06T05:52:58Z",
          "conclusion": "success",
          "name": "Set up Python",
          "number": 3,
          "started_at": "2026-08-06T05:52:58Z",
          "status": "completed"
        },
        {
          "completed_at": "2026-08-06T05:52:59Z",
          "conclusion": "success",
          "name": "Compile Python sources",
          "number": 4,
          "started_at": "2026-08-06T05:52:58Z",
          "status": "completed"
        },
        {
          "completed_at": "2026-08-06T05:52:59Z",
          "conclusion": "success",
          "name": "Test repository contract",
          "number": 5,
          "started_at": "2026-08-06T05:52:59Z",
          "status": "completed"
        },
        {
          "completed_at": "2026-08-06T05:52:59Z",
          "conclusion": "success",
          "name": "Verify public repository hygiene",
          "number": 6,
          "started_at": "2026-08-06T05:52:59Z",
          "status": "completed"
        },
        {
          "completed_at": "2026-08-06T05:53:00Z",
          "conclusion": "success",
          "name": "Run small deterministic reproduction",
          "number": 7,
          "started_at": "2026-08-06T05:52:59Z",
          "status": "completed"
        },
        {
          "completed_at": "2026-08-06T05:53:00Z",
          "conclusion": "success",
          "name": "Post Set up Python",
          "number": 13,
          "started_at": "2026-08-06T05:53:00Z",
          "status": "completed"
        },
        {
          "completed_at": "2026-08-06T05:53:00Z",
          "conclusion": "success",
          "name": "Post Check out repository",
          "number": 14,
          "started_at": "2026-08-06T05:53:00Z",
          "status": "completed"
        },
        {
          "completed_at": "2026-08-06T05:53:00Z",
          "conclusion": "success",
          "name": "Complete job",
          "number": 15,
          "started_at": "2026-08-06T05:53:00Z",
          "status": "completed"
        }
      ],
      "workflow_name": "Reproduce small"
    },
    {
      "completed_at": "2026-08-06T05:52:52Z",
      "conclusion": "skipped",
      "created_at": "2026-08-06T05:52:52Z",
      "html_url": "https://github.com/obedebessa/eacp-operational-provenance/actions/runs/31075453078/job/92532375147",
      "id": 92532375147,
      "labels": [
        "ubuntu-latest"
      ],
      "name": "release-contract",
      "run_attempt": 1,
      "run_id": 31075453078,
      "started_at": "2026-08-06T05:52:52Z",
      "status": "completed",
      "steps": [],
      "workflow_name": "Reproduce small"
    }
  ],
  "projection": {
    "correlation_derivation": "repository-id + run-id + run-attempt",
    "correlation_id": "eacp-gha-1324720646-31075453078-1",
    "intent": "software_delivery",
    "kubernetes_target": {
      "annotation_key": "eacp.io/correlation-id",
      "name": "eacp-cross-plane",
      "namespace": "eacp-cross-plane-v13",
      "resource": "deployment"
    },
    "schema_version": "eacp.evidence/1.3.0",
    "service": "obedebessa/eacp-operational-provenance",
    "subject": null
  },
  "repository": {
    "full_name": "obedebessa/eacp-operational-provenance",
    "html_url": "https://github.com/obedebessa/eacp-operational-provenance",
    "id": 1324720646,
    "private": false
  },
  "run": {
    "actor": {
      "html_url": "https://github.com/obedebessa",
      "id": 40583383,
      "login": "obedebessa",
      "type": "User"
    },
    "api_url": "https://api.github.com/repos/obedebessa/eacp-operational-provenance/actions/runs/31075453078",
    "artifacts_url": "https://api.github.com/repos/obedebessa/eacp-operational-provenance/actions/runs/31075453078/artifacts",
    "conclusion": "success",
    "created_at": "2026-08-06T05:52:51Z",
    "event": "push",
    "head_branch": "main",
    "head_sha": "829d1babff46c0b52c01dfcc856148d91b50dc93",
    "html_url": "https://github.com/obedebessa/eacp-operational-provenance/actions/runs/31075453078",
    "id": 31075453078,
    "jobs_url": "https://api.github.com/repos/obedebessa/eacp-operational-provenance/actions/runs/31075453078/jobs",
    "name": "Reproduce small",
    "node_id": "WFR_kwLOTvWiBs8AAAAHPD3Ilg",
    "path": ".github/workflows/reproduce-small.yml",
    "run_attempt": 1,
    "run_number": 3,
    "run_started_at": "2026-08-06T05:52:51Z",
    "status": "completed",
    "triggering_actor": {
      "html_url": "https://github.com/obedebessa",
      "id": 40583383,
      "login": "obedebessa",
      "type": "User"
    },
    "updated_at": "2026-08-06T05:53:05Z",
    "workflow_id": 328333438
  },
  "schema_version": "eacp.github-actions.capture/1.3.0"
}
